addr,rooms,ruler,floor,price,descr
Ռուբինյանց,2 սենյակ,50 մ2, հարկ 3/4 ," Վաճառք - 49,000 $ "," Ռուբինյանց փողոցում, Երևան Սիթի սուպերմարկետից ոչ հեռու վաճառվում է 2 սենյականոց կապիտալ վերանորոգված բնակարան, որը գտնվում է 4 հարկանի պանելային (խոշոր) շենքի 3-րդ հարկում: Ընդհանուր մակերեսը կազմում է 50 քմ։ Բնակարանում առկա են բոլոր կոմունիկացիաները: Տեղադրված է մուտքի երկաթե դուռ, եվրոպատուհաններ, հատակը ծածկված է լամինատով, ունի զգեստասենյակ: Խոհանոցը և սանհանգույցը սալիկապատված են, հագեցած սանտեխնիկայով: Բակում նախատեսված է ազատ տարածություն՝ մեքենաներ կայանելու համար։ Մոտակայքում են գտնվում բոլոր անհրաժեշտ խանութները, բանկի մասնաճյուղերը և ժամանցի վայրերը։ Վաճառվում է խոհանոցի կահույքի և ներկառուցված պահարանների հետ միասին: "
Եկմալյան,3 սենյակ,130 մ2," հարկ 3/12 , նորակառույց "," Վաճառք - 249,000 $ "," Եկմալյան փողոցում, Մալիբու այգու հարևանությամբ վաճառվում է 3 սենյականոց բնակարան` 130 քմ մակերեսով, որը գտնվում է 12 հարկանի նորակառույց շենքի 3-րդ հարկում: Բնակարանը վերանորոգված է, ջեռուցվում է կենտրոնացված համակարգով: Տեղադրված է երկաթյա մուտքի դուռ, եվրոպատուհաններ, հատակը ծածկված է մանրահատակով: Առկա է 2 սանհանգույց և բաց պատշգամբ` գեղեցիկ տեսարանով: Սանհանգույցները սալիկապատված են, հագեցած են սանտեխնիկայով: Շենքում գործում է անխափան վերելակ, ապահովված է անվտանգության համակարգով, առկա է ստորգետնյա ավտոկայանատեղի: Մոտակայքում են գտնվում խանութները, բանկերը և ժամանցի վայրերը։ "
Թամանյան,3 սենյակ,121 մ2," հարկ 6/12 , նորակառույց "," Վաճառք - 320,000 $ "," Քաղաքի լավագույն հատվածում, Թամանյան փողոցում վաճառվում է 3 սենյականոց ընդարձակ բնակարան` 121 քմ մակերեսով, որը գտնվում է 12 հարկանի նորակառույց շենքի 6-րդ հարկում, գեղատեսիլ Կասկադ համալիրի մոտայքում: Բնակարանը կապիտալ վերանորոգված է, բարձրարժեք կահույքով կահավորված և որակյալ տեխնիկայով համալրված: Ջեռուցվում է կենտրոնացված համակարգով: Տեղադրված է օդորակիչ, եվրոպատուհաններ, հատակը ծածկված է մանրահատակով: Առաստաղը ձևավորված է գեղեցիկ լուսային էֆեկտներով։ Առկա է 2 սանհանգույց և բաց պատշգամբ` գեղեցիկ տեսարանով: Սանհանգույցները սալիկապատված են եվրոպական արտադրության սալիկներով, հագեցած են սանտեխնիկայով: Շենքում գործում է անխափան վերելակ, ապահովված է անվտանգության համակարգով: Մոտակայքում է գտնվում Օպերայի և Բալետի թատրոնը, բազում սրճարաններ, բրենդային խանութներ, տարատեսակ ժամանցի վայրեր և այլ կենտրոններ։ Վաճառվում է կահույքի և տեխնիկայի հետ միասին: Առկա է ստորգետնյա ավտոկայանատեղի 2 մեքենայի համար նախատեսված, արժեքը` 40.000$: "
Նորաշեն թաղ.,2 սենյակ,60 մ2, հարկ 2/14 ," Վաճառք - 50,500 $ "," Վաճառվում է 2 սենյականոց բնակարան` 60 քմ մակերեսով, որը գտնվում է 16-րդ թաղամասում՝ 14 հարկանի շենքի 2-րդ հարկում։ Բնակարանը կապիտալ վերանորոգված է, տեղադրված են եվրո պատուհաններ, հատակը ծածկված է կաղնե մանրահատակով։ Խոհանոցը և 2 սանհանգույցները սալիկապատված են եվրոպական արտադրության սալիկներով և հագեցած են սանտեխնիկայով։ Բնակարանը ապահովված է որակյալ կահույքով և կենցաղային տեխնիկայով, առկա են ներկառուցված պահարաններ, խորդանոց և նկուղ։ Ունի բաց պատշգամբ։ Շենքում գործում է անխափան վերելակ։ Բակում կա խաղահրապարակ։ Մոտակայքում են գտնվում խանութները, բանկերը, Մալայանի անվան հիվանդանոցը։ Վաճառվում է խոհանոցի կահույքի հետ միասին։ "
Դավիթ Բեկ,3 սենյակ,85 մ2," հարկ 2/3 , նորակառույց ", Վաճառք - 850 $ ," Էրեբունի համայնքում` Դավիթ Բեկի փողոցում, Նոր Զովք սուպերմարկետի հարևանությամբ վաճառվում է 3 սենյականոց լուսավոր բնակարան` որը զբաղեցնում է 85 քմ մակերես և գտնվում է 3 հարկանի նորակառույց մոնոլիտ շենքի 2-րդ հարկում: Բնակարանը զրոյական վիճակում է, բոլոր կոմունիկացիաները անցկացված են, տեղադրված են եվրո պատուհաններ, պատերը գաջած և հարթեցված են, կա սանհանգույց և 2 բացօթյա պատշգամբ: Նախատեսված է նաև զգեստասենյակ: Կա նմանատիպ 3 սենյականոց բնակարան` 89 քմ մակերեսով` 3-րդ հարկում: Գինը` 1 քմ - 500.000 դրամ: "
Լվովյան,3 սենյակ,78 մ2, հարկ 3/5 ," Վաճառք - 72,000 $ "," Վաճառվում է 3 սենյականոց բնակարան` 78 քմ մակերեսով, որը գտնվում է Լվովյան փողոցում՝ 5 հարկանի քարե շենքի 3-րդ հարկում։ Բնակարանն ունի հին նորոգում, տեղադրված է անհատական ջեռուցման համակարգ, հատակը ծածկված է մանրահատակով և սալիկներով, սանհանգույցը սալիկապատված է, հագեցած սանտեխնիկայով։ Կա բաց պատշգամբ։ Բնակարանը հարմարավետ կահավորված է և ապահովված է կենցաղային տեխնիկայով։ Բակում կա խաղահրապարակ։ Մոտակայքում են գտնվում խանութները, բանկերը, սրճարաններն ու զբոսայգին։ "
Մ. Բաղրամյան պող.,3 սենյակ,150 մ2," հարկ 6/17 , նորակառույց "," Վաճառք - 295,000 $ "," Վաճառվում է 3 սենյականոց 150 քմ մակերեսով լուսավոր բնակարան, որը գտնվում է Բաղրամյան պողոտայում՝ 17 հարկանի նորակառույց շենքի 6-րդ հարկում։ Բնակարանը կապիտալ վերանորոգված է, տեղադրված են եվրո պատուհաններ, հատակը ծածկված է լամինատով և սալիկներով, սանհանգույցները սալիկապատված են եվրոպական արտադրության սալիկներով և հագեցած են սանտեխնիկայով։ Ջեռուցումը և հովացումը կատարվում են կենտրոնացված համակարգով, տեղադրված է բոյլեր (ջրատաքացուցիչ)։ Բնակարանն ապահովված է կահույքով և կենցաղային տեխնիկայով, կան ներկառուցված պահարաններ։ Ունի 3 բաց պատշգամբ՝ գեղեցիկ տեսարանով։ Շենքում առկա է 3 հարկանի ստորգետնյա կայանատեղի, 2 վերելակ և ապահովված է անվտանգության համակարգով։ Մոտակայքում են գտնվում 8-րդ պոլիկլինիկան, բանկերը, դպրոցները, խանութներն ու ժամանցի վայրերը։ Վաճառվում է կահույքի և տեխնիկայի հետ միասին։ Գործակալների հետ չեմ համագործակցում: "
Վերին Անտառային,4 սենյակ,180 մ2," հարկ 3/3 , նորակառույց "," Վաճառք - 520,000 $ "," Վաճառվում է 4 սենյականոց եվրովերանորոգված և չբնակեցված ընդարձակ բնակարան` 180 քմ մակերեսով, որը գտնվում է Վերին Անտառային փողոցում՝ 3 հարկանի նորակառույց շենքի 3-րդ հարկում։ Բնակարանը դիզայներական լուծումներով թանկարժեք նյութերով նորոգված է, տեղադրված են անհատական ջեռուցման և օդորակման համակարգեր, եվրո պատուհաններ, հատակը ծածկված է լամինատով և սալիկներով, առկա է 3 սանհանգույց, որոնք սալիկապատված են բարձրորակ սալիկներով և հագեցած սանտեխնիկայով։ Բնակարանն ունի բաց պատշգամբներ՝ հիասքանչ տեսարաններով։ Բոլոր սենյակները ժամանակակից ոճով կահավորված են և ապահովված կենցաղային տեխնիկայով, կա զգեստասենյակ և լվացքատուն։ Շենքում գործում է վերելակ, ապահովված է անվտանգության համակարգով։ Մոտակայքում կան խանութներ, բանկեր, դպրոցներ, սրճարաններ և տրանսպորտի կանգառներ։ Վաճառվում է կահույքի, տեխնիկայի ու 40 քմ մակերեսով ավտոկայանատեղիի հետ միասին։ Տանիքում առկա է 180 քմ մակերեսով ընդհանուր օգտագործման տարածք: "
Արգիշտի,4 սենյակ,124 մ2," հարկ 11/15 , նորակառույց "," Վաճառք - 145,000 $ "," Արգիշտի փողոցում, նորակառույց 15 հարկանի մոնոլիտ շենքի 11-րդ հարկում վաճառվում է 4 սենյականոց ընդարձակ և լուսավոր բնակարան` 124 քմ մակերեսով: Բնակարանը գտնվում է 0-ական վիճակում, տեղադրված են մուտքի երկաթյա դուռ, եվրոպատուհաններ: Պատերը գաջված են, բաժանումները դեռ արված չեն, ինչը հնարավորություն է տալիս գնորդին սենյակները վերապլանավորել իր հայեցողությամբ: Առկա է 2 սանհանգույց և բաց պատշգամբ` գեղեցիկ տեսարանով: Շենքում գործում է 2 վերելակ և հանձնված է շահագործման: Մոտակայքում կան բազում խանութներ և ժամանցի վայրեր: "
Մամիկոնյանց,3 սենյակ,76 մ2, հարկ 4/9 ," Վաճառք - 100,000 $ "," Մամիկոնյանց փողոցում վաճառվում է 3 սենյականոց բնակարան` 76 քմ մակերեսով, որը գտնվում է 9 հարկանի շենքի 4-րդ հարկում: Բնակարանը կապիտալ վերանորոգված է, տեղադրված է երկաթյա դուռ, եվրոպատուհաններ, հատակը ծածկված է տաքացվող պրեսգրանիտով: Ջեռուցումն իրականացվում է անհատական համակարգով։ Սանհանգույցը պատված է սալիկներով և հագեցած է սանտեխնիկայով: Բոլոր սենյակները և խոհանոցը հարմարավետ կահավորված են։ Շենքում գործում է անխափան վերելակ: Մոտակայքում են գտնվում բոլոր անհրաժեշտ խանութները, դպրոցը, տրանսպորտի կանգառները։ Հնարավոր է վաճառք կահույքի հետ միասին` հավելավճարով: "
Գրիբոյեդով 58,3 սենյակ,100 մ2," հարկ 7/16 , նորակառույց ", Վաճառք - պայման. ," Վաճառվում է 3 սենյականոց բնակարան` 100 քմ մակերեսով, որը գտնվում է Գրիբոյեդով փողոցում՝ 16 հարկանի նորակառույց շենքի 7-րդ հարկում։ Բնակարանը գտնվում է զրոյական վիճակում, տեղադրված է մուտքի երկաթյա դուռ, եվրո պատուհաններ, սենյակների բաժանումներն արված են, պատերը՝ գաջած, բոլոր կոմունիկացիաները անցկացված են։ Բնակարանն ունի 2 սանհանգույց և բաց պատշգամբ, որտեղից բացվում է հիանալի տեսարան։ Նախատեսված է անհատական ​​ջեռուցման համակարգ: Բնակարանի վերանորոգման աշխատանքները ընթացքի մեջ են և շահագործման կհանձնվի կապիտալ նորոգված վիճակում։ Շենքն ունի 2 վերելակ և անվտանգության համակարգ։ Առկա է կայանատեղի և խաղահրապարակ։ Մոտակայքում կան խանութներ, բանկեր, դպրոցներ և տրանսպորտի կանգառներ։ "
Արգիշտի,4 սենյակ,151 մ2," հարկ 5/14 , նորակառույց "," Վաճառք - 200,000 $ "," Վաճառվում է 4 սենյականոց բնակարան` 151 քմ մակերեսով, որը գտնվում է Գլենդել Հիլլզ թաղամասում, Արգիշտի փողոցում՝ 14 հարկանի նորակառույց բարձրակարգ շենքի 5-րդ հարկում։ Բնակարանը գտնվում է զրոյական վիճակում՝ կոմունիկացիաները անցկացված են, միջնապատերը սվաղած, մուտքի երկաթյա դուռը և պանորամային պատուհանները՝ տեղադրված։ Ունի 3 սանհանգույց և բաց պատշգամբ՝ հիասքանչ տեսարաններով։ Շենքն ունի 2 վերելակ և անվտանգության համակարգ։ Բակը խնամված է, առկա է ավտոկայանատեղի և խաղահրապարակ։ "
Արգիշտի,2 սենյակ,75 մ2," հարկ 12/14 , նորակառույց "," Վաճառք - 105,000 $ "," Վաճառվում է 2 սենյականոց (վերափոխված 3-ի) բնակարան` 75 քմ մակերեսով, որը գտնվում է Գլենդել Հիլլզ թաղամասում, Արգիշտի փողոցում՝ 14 հարկանի նորակառույց բարձրակարգ շենքի 12-րդ հարկում։ Բնակարանը գտնվում է զրոյական վիճակում՝ կոմունիկացիաները անցկացված են, միջնապատերը մասամբ սվաղած, մուտքի երկաթյա դուռը և եվրո պատուհանները տեղադրված են։ Առկա է 2 սանհանգույց։ Շենքն ունի 2 վերելակ և անվտանգության համակարգ։ Բակը խնամված է, առկա է ավտոկայանատեղի և խաղահրապարակ։ "
Մաշտոցի պողոտա,6 սենյակ,477 մ2," հարկ 11/12 , նորակառույց ", Վաճառք - պայման. ," Վաճառվում է պենտհաուս Երևանի կենտրոնում, Արգիշտի-Մաշտոց փողոցների խաչմերուկի մոտ գտնվող նորակառույց, էլիտար շենքում։ Ընդհանուր մակերեսը՝ 477 ք.մ.։ 1-ին հարկ (մակերեսը՝ 240 ք.մ.)։ Այս հարկը բաղկացած է՝ նախասրահից, ընդարձակ հյուրասենյակից և խոհանոցից, առկա է նաև՝ սանհանգույց, լվացքասենյակ և աշխատասենյակ՝ իր առանձին սանհանգույցով։ Աշխատասենյակին կից կա բաց պատշգամբ, որտեղից բացվում է գեղեցիկ տեսարան։ 2-րդ հարկում գտնվում են 3 ննջասենյակները՝ իրենց առանձին սանհանգույցներով և զգեստասենյակներով, ինչպես նաև 1 ընտանեկան ընդարձակ սենյակ, որի մի հատվածը նախատեսված է երեխաների համար։ Այս սենյակը նույնպես ունի իր առանձին սանհանգույցը։ Նորոգման աշխատանքները կատարված են մասնակի, պատերը գաջված են, հոսանքի լարերը ամբողջությամբ անցկացված։ Նախատեսված է անհատական ջեռուցման ֆանկոյլային համակարգ։ Խողովակներն ամբողջությամբ մոնտաժված են: Պենտհաուսն ունի նաև ընդարձակ տեռռասա։ Այստեղից բացվում է 360 աստիճան շրջանագծով հիանալի տեսարան, որտեղից երևում են՝ Սուրբ Սարգիս եկեղեցին և Երևանի քաղաքապետարանն՝ իր հարակից պուրակներով, քաղաքի ամենագեղեցիկ շինություններից մեկը՝ Երևանի կոնյակի-գինու գործարանը, Երևանի բերդապարիսպը և վերջապես հրազդանի կիրճը, որի ֆոնին վեր է խոյանում բիբլիական Արարատն իր ողջ վեհությամբ։ Պենտհաուսն ունի հարկերը և տեռռասան իրար կապող վերելակի հնարավորություն։ Վերելակի տեղակայման դիրքը և դեպի տեռռասա դուրս եկող ելքը կորոշի պենտհաուսի նոր սեփականատերը։Առկա է ստորգետնյա ավտոկայանատեղի ձեռք բերելու հնարավորություն։ Այս նորակառույց համալիրը, որում գտնվում է պենտհաուսը՝ հանդիսանում է Երևան քաղաքի ամենահայտնի շինություններից մեկը։ Այն կառուցված է շինարարական բոլոր նորմերին համապատասխան և ունի բարձր սեյսմակայունություն։ Ձեռք բերելով այս պենտհաուսը, դուք կդառնաք այդ հարկի միակ բնակիչը։ "
"Փ․ Բուզանդ 3, բն. 25",10 սենյակ,600 մ2," հարկ 7/8 , նորակառույց ", Վաճառք - պայման. ," Բուզանդ փողոցում՝ Հանրապետության հրապարակի և Վերնիսաժի նոր բարեկարգված այգու հարևանությամբ, վաճառվում է շքեղ և էքսկլյուզիվ բնակարան, որը գտնվում է 8 հարկանի նորակառույց ""Ա"" կլասսի էլիտար ""Ռոյալ Կլասսիկ Հաուս"" շենքի 7-րդ հարկում: Շենքն ունի 9 բալ սեսմոկայունություն և գեղեցիկ ճարտարապետաշինարարական տեսք։ Շենքը տեսահսկվում է, ունի անվտանգության աշխատակիցներ, դռնապան, սպասարկող անձնակազմ։ Բնակարանը երկկողմանի է, ունի 6 ննջասենյակ՝ բոլորը իրենց լոգաենյակներով և զգեստասենյակներով և մեկ առանձին լոգասենյակ՝ նախատեսված հյուրերի համար, 7 բաց պատշգամբ՝ հիասքանչ տեսարաններով, 3 խոհանոց, 3 հյուրասենյակ և գրադարան։ Ներսի պատերը և հատակը պատրաստված են բնական քարից և փայտից, հատակը տաքացվող է, հյուրասենյակում ունի բուխարի և ցայտաղբյուր։ Ամբողջ գույքը, տեխնիկան, սանհանգույցի պարագաները և սալիկները բարձրակարգ և թանկարժեք բրենդի են և ներկրված են արտասահմանյան լավագույն արտադրողներից։ Բնակարանն ունի կլիման կարգավորող համակարգ, օդափոխման և անհատական ջեռուցման և հովացման համակարգեր։ Ավտոմեքենաների համար հատկացված է ստորգետնյա կայանատեղի՝ 2 մեքենայի համար նախատեսված՝ օդափոխման համակարգով։ "
Փ․ Բուզանդ,5 սենյակ,310 մ2," հարկ 7/8 , նորակառույց ", Վաճառք - պայման. ," Բուզանդ փողոցում՝ Հանրապետության հրապարակի և Վերնիսաժի նոր բարեկարգված այգու հարևանությամբ, վաճառվում է ընդարձակ և էքսկլյուզիվ բնակարան, որը գտնվում է 8 հարկանի նորակառույց ""Ա"" կլասսի էլիտար ""Ռոյալ Կլասսիկ Հաուս"" շենքի 7-րդ հարկում: Ընդհանուր 310 քմ է, բաղկացած է 6 սենյակից, բոլոր 5 ննջասենյակները ունեն իրենց լոգասենյակները: Շենքն ունի 9 բալ սեսմոկայունություն և գեղեցիկ ճարտարապետաշինարարական տեսք։ Շենքը տեսահսկվում է, ունի անվտանգության աշխատակիցներ, դռնապան, սպասարկող անձնակազմ։ 1 քմ-6500 $ "
Քեռու 35,2 սենյակ,108 մ2," հարկ 11/18 , նորակառույց "," Վաճառք - 185,000 $ "," Վաճառվում է 2 սենյականոց բնակարան՝ 108 ք.մ. մակերեսով, ավտոկայանատեղիով, որը գտնվում է Քեռու փողոցում՝ 18 հարկանի էլիտար նորակառույց շենքի 11-րդ հարկում, որը ունի գեղեցիկ տեսարան դեպի Մասիս սար: Բնակարանը կապիտալ եվրո նորոգված է, կահավորված է և հագեցած է ժամանակակից տեխնիկայով։ Տեղադրված է երկաթե դուռ, եվրո պատուհաններ, օդորակիչ, հատակը ծածկված է մանրահատակով։ Ջեռուցվում է գազի կաթսայի միջոցով։ Սանհանգույցները և խոհանոցը պատված են սալիկներով, հագեցած է սանտեխնիկայով։ Շենքն ունի գեղեցիկ բակ, անվտանգության աշխատակից, խաղահրապարակ, մարզասրահ և լողավազան։ Շենքի սպասարկման վճարը կազմում է 37000 դր. "
Ազատության պողոտա,2 սենյակ,67 մ2, հարկ 9/9 ," Վաճառք - 85,000 $ "," Ազատության պողոտայում վաճառվում է 2 ձևափոխված 3 սենյականոց բնակարան` 67 քմ. մակերեսով` 9 հարկանի պանելային շենքի 9-րդ հարկում: Բնակարանը վերանորոգված է: Առաստաղի բարձրությունը` 2,75 մետր է: Ունի անհատական ջեռուցման համակարգ, օդորակիչ: Պատուհանից բացվում է գեղեցիկ տեսարան: Կանաչապատ և գեղեցիկ բակ, խաղահրապարակ, զբոսայգի: Քաղաքի այս հատվածը աչքի է ընկնում նաև իր տրանսպորտային հասանելիությամբ, մանկապարտեզների, դպրոցների, խոշոր առևտրային կենտրոնների առկայությամբ: Էկոլոգիապես բարենպաստ միջավայրում առանձնանում է իր շշուկով և մաքուր օդով, սքանչելի տեսարաններով: "
