addr,rooms,ruler,floor,price,descr
Ծարավ Աղբյուր,4 սենյակ,152 մ2," հարկ 5/10 , նորակառույց "," Վաճառք - 170,000 $ "," Վաճառվում է 4 սենյականոց բնակարան՝ 152 ք.մ. մակերեսով Ծարավ Աղբյուր փողոցում՝ 10 հարկանի նորակառույց շենքի 5-րդ հարկում: Բնակարանը կապիտալ եվրո վերանորոգված է։ Տեղադրված է երկաթյա դուռ, եվրո պատուհաններ, հատակը ծածկված է մանրահատակով և տաքացվող է: Ջեռուցվում է գազի կաթսայի միջոցով, տեղադրված է նաև օդորակիչ։ Սանհանգույցը և խոհանոցը պատված է սալիկներով, հագեցած է սանտեխնիկայով: Բնակարանն ունի 2 բաց պատշգամբ, որից բացվում է գեղեցիկ տեսարան: Բնակարանի հետ վաճառվում է նաև ստորգետնյա կայանատեղ` նախատեսված 2 մեքենայի համար` հավելավճարով: Հնարավոր է նաև բնակարանի վաճառքը կահույքի և տեխնիկայի հետ միասին` նույնպես հավելավճարով: "
Փ․ Բուզանդ,1 սենյակ,41 մ2," հարկ 11/17 , նորակառույց "," Վաճառք - 165,000 $ "," Վաճառվում, երկարաժամկետ վարձակալությամբ կամ օրավարձով է տրվում 1 սենյականոց ստուդիո ոճի շատ գեղեցիկ բնակարան՝ 41 ք.մ. մակերեսով, որը գտնվում է Բուզանդի փողոցում՝ նորակառույց (Մալիբու) այգու հարևանությամբ, 17 հարկանի նորակառույց շենքի 11-րդ հարկում։ Բնակարանը եվրո նորոգված է։ Ջեռուցում և հովացումը կենտրոնացված է: Սանհանգույցը հագեցած է սանտեխնիկայով: Բնակարանը կահավորված է և ապահովված անհրաժեշտ տեխնիկայով։ Կա կաբելային հեռուստատեսություն և ինտերնետ։ Բնակարանն ունի բաց պատշգամբ, որից բացվում է հիանալի տեսարան: Մոտակայքում են գտնվում բոլոր հանգստի և ժամանցի վայրերը։ Շենքն ունի անվտանգության համակարգ: "
Հյուսիսային պող.,2 սենյակ,84 մ2," հարկ 7/10 , նորակառույց "," Վաճառք - 294,000 $ "," Հյուսիսային պողոտայում, քաղաքի լավագույն հատվածում վաճառվում է 2 սենյականոց բնակարան 84 ք.մ. ընդհանուր մակերեսով, որը գտնվում է 10 հարկանի նորակառույց էլիտար շենքի 7-րդ հարկում: Բնակարանը գտնվում է զրոյական վիճակում, տեղադրված է մուտքի երկաթյա դուռ, եվրո պատուհաններ: Միջսենյակային բաժանումները կատարված չեն, ինչը գնորդին հնարավորություն կտա պլանավորել ինտերյերը իր հայեցողությամբ: Բոլոր կոմունիկացիաները առկա են: Կա բացօթյա պատշգամբ` գեղեցիկ տեսարանով: Նախատեսված է կենտրոնացված ջեռուցման համակարգ: Շենքն ունի 2 վերելակ, անվտանգության համակարգ: Շենքում գործում է փակ լողավազան և մարզասրահ, այսպիսով բնակիչների համար ապահովված են բոլոր պայմանները լիարժեք կյանքի համար: Մոտակայքում են գտնվում Հանրապետության հրապարակը, օպերային թատրոնը, բոլոր բրենդային խանութները և ժամանցի վայրերը: Կան նմանատիպ այլ բնակարաններ` 84- 250 ք.մ. մակերեսներով: "
Հյուսիսային պող.,3 սենյակ,116 մ2," հարկ 8/10 , նորակառույց "," Վաճառք - 406,000 $ "," Հյուսիսային պողոտայում, քաղաքի լավագույն հատվածում վաճառվում է 3 սենյականոց բնակարան 116 ք.մ. ընդհանուր մակերեսով, որը գտնվում է 10 հարկանի նորակառույց էլիտար շենքի 8-րդ հարկում: Բնակարանը գտնվում է զրոյական վիճակում, տեղադրված է մուտքի երկաթյա դուռ, եվրո պատուհաններ: Միջսենյակային բաժանումները կատարված չեն, ինչը գնորդին հնարավորություն կտա պլանավորել ինտերյերը իր հայեցողությամբ: Բոլոր կոմունիկացիաները առկա են: Նախատեսված է կենտրոնացված ջեռուցման համակարգ: Ունի 2 բացօթյա պատշգամբ` գեղեցիկ տեսարանով: Շենքն ունի 2 վերելակ, անվտանգության համակարգ: Շենքում գործում է փակ լողավազան և մարզասրահ, այսպիսով բնակիչների համար ապահովված են բոլոր պայմանները լիարժեք կյանքի համար: Մոտակայքում են գտնվում Հանրապետության հրապարակը, օպերային թատրոնը, բոլոր բրենդային խանութները և ժամանցի վայրերը: Կան նմանատիպ այլ բնակարաններ` 84- 250 ք.մ. մակերեսներով: "
Մամիկոնյանց,4 սենյակ,96 մ2," հարկ 9/14 , նորակառույց "," Վաճառք - 130,000 $ "," Մամիկոնյանց փողոցում` Դիալաբի մոտակայքում, վաճառվում է 4 սենյականոց բնակարան: Գտնվում է 14 հարկանի բազմաբնակարան շենքի 9-րդ հարկում: Ընդհանուր մակերեսը 95.5 քմ է, առաստաղի բարձրությունը 3 մետր է: Բաղկացած է հյուրասենյակից՝ ներառյալ խոհանոց, երեք ննջասենյակից, երկու սանհանգույցից, նախասրահից և բաց պատշգամբից: Բնակարանը գտնվում է 0-ական վիճակում, պատերը գաջված, մուտքի դուռը և եվրո պատուհանները՝ տեղադրված: Մոտակայքում են գտնվում բոլոր անհրաժեշտ խանութները, դպրոց, մանկապարտեզ, զբոսանքի այգիներ և այլ կարևոր ենթակառուցվածքներ: Շենքը շահագործման է հանձնվելու 2022 թվ. հունվարին: "
Ծարավ Աղբյուր,2 սենյակ,73 մ2," հարկ 11/13 , նորակառույց "," Վաճառք - 107,000 $ "," Վաճառվում է 2 սենյականոց ընդարձակ և լուսավոր բնակարան՝ 73 ք.մ. մակերեսով, որը գտնվում է Ծարավ Աղբյուր փողոցում` էլիտար թաղամասում, 13 հարկանի նորակառույց մոնոլիտ շենքի 11-րդ հարկում: Բնակարանը կապիտալ վերանորոգված է, տեղադրված է երկաթե դուռ, եվրո պատուհաններ, օդորակիչ, հատակը ծածկված է բարձրորակ մանրահատակով: Ջեռուցվում է գազի կաթսայի միջոցով։ Առկա է զգեստասենյակ` լի ներկառուցված դարակներով: Սանհանգույցը սալիկապատված է եվրոպական արտադրության սալիկներով, հագեցած է սանտեխնիկայով: Ունի բացօթյա պատշգամբ, որոնցից բացվում է գեղեցիկ համայնապատկեր: Բնակարանն ապահովված է կահույքով և անհրաժեշտ տեխնիկայով։ Շենքում գործում է 2 վերելակ, տեղադրված է անվտանգության համակարգ: Բակը շատ բարեկարգ է, ունի խաղահրապարակ, հարևանությամբ է գտնվում ""Գազպրոմ"" մարզադպրոցը և բոլոր անհրաժեշտ ենթակառուցվացքները: Վաճառվում է կահույքի և տեխնիկայի հետ միասին: "
Հյուսիսային պող.,3 սենյակ,172 մ2," հարկ 9/9 , նորակառույց "," Վաճառք - 380,000 $ "," Հյուսիսային պողոտայում` Պուշկին փողոցի խաչմերուկում, 9 հարկանի նորակառույց շենքի 9-րդ հարկում, վաճառվում է յուրահատուկ ոճով, դուպլեքս 3 սենյականոց բնակարան։ Ընդհանուր մակերեսը կազմում է 172 քմ.։ Բնակարանը կապիտալ վերանորոգված է, ապահովված է բոլոր անհրաժեշտ կոմունիկացիաներով։ Տեղադրված է անհատական ջեռուցման և հովացման համակարգ։ Բոլոր սենյակները կահավորված են ժամանակակից և հարմարավետ կահույքով և հագեցած են տեխնիկայով։ Մոտակայքում կարող եք գտնել բազմաթիվ խանութներ և ժամանցի կենտրոններ։ Բնակարանն ունի տեռասսա` բուխարիով և հիանալի տեսարանով դեպի Արարատ լեռը: Շենքն ունի բացօթյա ավտոկայանատեղ և չունի սպասարկման վճար: "
Կորյուն,4 սենյակ,215 մ2, հարկ 3/3 ," Վաճառք - 495,000 $ "," Երևանի գեղեցիկ փողոցներից մեկում՝ Կորյունի փողոցում վաճառվում է 4 սենյականոց բնակարան, որի ընդհանուր մակերեսը 215 քմ է: Այն կապիտալ վերանորոգված է, տեղադրված է անհատական ջեռուցման համակարգ և գտնվում է 3 հարկանի քարե (Ստալինյան նախագիծ, ծածկերը բետոնե) շենքի 3-րդ և 4-րդ հարկերում: Առաստաղի բարձրություն 3 մետր Է: Բաղկացած է ընդարձակ հյուրասենյակից, խոհանոցից, աշխատասենյակից, 3 ննջասենյակներից, 2 սանհանգույցից, 2 բաց պատշգամբներից, որոնք ունեն տեսարան դեպի Կորյուն փողոց և դեպի բակ: Տեղադրված են օդորակիչներ, հատակը ծածկված է բարձրորակ մանրահատակով և սալիկներով: Սանհանգույցները սալիկապատված են, հագեցած սանտեխնիկայով: Վերանորոգման ընթացքում օգտագործվել են բարձրորակ նյութեր` 10 կաղնե դռներ, մարմարե պատուհանագոգեր, ապահովված է 8 կՎտ արևային կայանով, բարձրակարգ ջեռուցման համակարգով և 220 լիտր ջրի տաքացման արևային համակարգով: "
Մ․ Սարյան,3 սենյակ,100 մ2, հարկ 3/5 ," Վաճառք - 140,000 $ "," Սարյան և Պուշկին փողոցների խաչմերուկում` ""Նոր Զովք"" սուպերմարկետի մոտակայքում վաճառվում է գեղեցիկ վերանորոգված և նորաոճ կահավորված` 3 սենյականոց բնակարան, որի ընդհանուր մակերեսը 100 քմ է և գտնվում է 5 հարկանի քարե շենքի 3-րդ հարկում: Մուտքի դուռը երկաթյա է, տեղադրված են եվրոպատուհաններ, օդորակիչներ։ Առկա է անհատական ջեռուցման համակարգ: Հատակը ծածկված է որակյալ մանրահատակով: Սանհանգույցը սալիկապատված է, հագեցած սանտեխնիկայով: Բնակարանը կահավորված է և համալրված անհրաժեշտ տեխնիկայով: Ունի բացօթյա պատշգամբ, որից բացվում է գեղեցիկ տեսարան դեպի Մալիբու այգի: Շրջակայքում կան ժամանցի վայրեր, սրճարաններ, խանութներ և կրթական հաստատություններ։ Վաճառվում է խոհանոցի կահույքի հետ միասին: "
Մոսկովյան,3 սենյակ,105 մ2, հարկ 3/5 ," Վաճառք - 250,000 $ "," Մոսկովյան և Տերյան փողոցների խաչմերուկում` քաղաքի լավագույն հատվածում վաճառվում կամ վարձակալության է տրվում 3 սենյականոց գեղեցիկ վերանորոգված և դեռևս չբնակեցված բնակարան, որի ընդհանուր մակերեսը կազմում է 105 քմ և գտնվում է 5 հարկանի քարե շենքի 3-րդ հարկում: Բնակարանը հիմնովին վերանորոգված է, ունի լուսավոր սենյակներ և մասամբ է կահավորված, կահույքը և տեխնիկան նոր են: Հյուրասենյակում տեղադրված է բուխարի, առկա է մուտքի երկաթե դուռ, օդորակիչներ, վիտրաժե պատուհաններ` խոհանոցում և ննջասենյակում: Ունի անհատական ջեռուցման և հովացման համակարգ: Հատակը ծածկված է պրեսգրանիտով, լոգասենյակը սալիկապատված է եվրոպական արտադրության սալիկներով և հագեցած է սանտեխնիկայով: Ունի բացօթյա պատշգամբ` գեղեցիկ երևանյան տեսարանով: Մոտակայքում են գտնվում բոլոր խանութները, բանկերը, սրճարաններն ու ժամանցի վայրերը: "
Կոմիտասի պող.,3 սենյակ,127 մ2, հարկ 4/6 ," Վաճառք - 127,000 $ "," Կոմիտասի պողոտայի և Վ. Վաղարշյան փողոցի խաչմերուկում, 2-րդ գծի վրա վաճառվում է 3 սենյականոց հարմարավետ բնակարան՝ 127 ք.մ. մակերեսով, որը գտնվում է 6 հարկանի` հատուկ նախագծով կառուցված` քարե շենքի 4-րդ հարկում։ Բնակարանը կապիտալ վերանորոգված է, ջեռուցվում է գազի կաթսայի միջոցով, հատակը ծածկված է գորգ մանրահատակով: Լոգասենյակը սալիկապատված է և հագեցած է անհրաժեշտ սանտեխնիկայով: Բնակարանը կահավորված է և ապահովված անհրաժեշտ գույքով: Ունի ընդարձակ բացօթյա պատշգամբ: Առկա է նկուղ և ավտոկայանատեղի` 2 մեքենայի համար նախատեսված` հավելավճարով: Մոտակայքում են գտնվում խանութները, բանկերը և ժամանցի վայրերը։ "
Այգեձորի,3 սենյակ,110 մ2," հարկ 4/8 , նորակառույց "," Վաճառք - 185,000 $ "," Վաճառվում է 3 սենյականոց գեղեցիկ կահավորված ընդարձակ բնակարան՝ 110 ք.մ. մակերեսով, որը գտնվում է Այգեձոր փողոցում՝ 8 հարկանի նորակառույց շենքի 4-րդ հարկում: Բնակարանը կապիտալ եվրո նորոգված է՝ համապատասխան եվրոպական ստանդարտների։ Տեղադրված է երկաթե դուռ, եվրո պատուհաններ, օդորակիչներ, հատակը ծածկված է որակյալ մանրահատակով: Ջեռուցվում է գազի կաթսայի միջոցով։ Սանհանգույցները և խոհանոցը պատված են եվրոպական արտադրության սալիկներով, հագեցած է սանտեխնիկայով: Բոլոր սենյակները և խոհանոցը կահավորված են ժամանակակից կահույքով, լի է ներկառուցված պահարաններով։ Ունի բաց տնտեսական պատշգամբ։ Բնակարանը վաճառվում է կահույքի և տեխնիկայի հետ միասին։ "
Խանջյան,4 սենյակ,175 մ2," հարկ 10/14 , նորակառույց "," Վաճառք - 280,000 $ "," Խանջյան փողոցում՝ վաճառվում է 4 սենյականոց բնակարան, այն գտնվում է 14 հարկանի նորակառույց շենքի 10-րդ հարկում։ Ունի 3 բաց պատշգամբ՝ հիանալի տեսարանով դեպի այգի: Ընդհանուր մակերեսը կազմում է 175 քմ։ Բնակարանը գտնվում է զրոյական վիճակում, սենյակների բաժանումներն արված են։ Բնակարանն ունի սեփականաշնորհման վկայական։ "
Ե. Քոչարի,4 սենյակ,110 մ2, հարկ 4/16 ," Վաճառք - 120,000 $ "," Վաճառվում է 4 սենյականոց բնակարան՝ 110 ք.մ. մակերեսով, որը գտնվում է Ե.Քոչար փողոցում՝ 16 հարկանի պանելային շենքի 4-րդ հարկում: Բնակարանը կապիտալ վերանորոգված է։ Տեղադրված է երկաթե դուռ, եվրո պատուհաններ, հատակը ծածկված է մանրահատակով։ Սանհանգույցը սալիկապատված է, հագեցած է սանտեխնիկայով: Ջեռուցվում է գազի կաթսայի միջոցով։ Վաճառվում է խոհանոցի կահույքով։ "
Արգիշտի,2 սենյակ,54 մ2," հարկ 10/14 , նորակառույց "," Վաճառք - 77,000 $ "," Արգիշտի փողոցում՝ Գլենդել Հիլս թաղամասում, վաճառվում է 2 սենյականոց ստուդիո ոճի բնակարան, որի ընդհանուր մակերեսը կազմում է 54 քմ.: Այն գտնվում է 14 հարկանի նորակառույց շենքի 10-րդ հարկում: Բնակարանը կապիտալ վերանորոգված է և չբնակեցված։ Տեղադրված են եվրո պատուհաններ, հատակը ծածկված է լամինատով։ Ջեռուցվում է գազի կաթսայի միջոցով: Բնակարանն ունի բաց պատշգամբ, որից բացվում է հիանալի տեսարան։ Բնակարանը վաճառվում է խոհանոցի կահույքի հետ միասին: "
Արամի փողոց,3 սենյակ,129 մ2, հարկ 4/12 ," Վաճառք - 400,000 $ "," Արամի փողոցում՝ Մաշտոց պողոտայի հարևանությամբ, վաճառվում է 3 սենյականոց յուրահատուկ դիզայնով բնակարան։ Ընդհանուր մակերեսը կազմում է 129 քմ.։ Այն գտնվում է 12 հարկանի նորակառույց շենքի 4-րդ հարկում: Բնակարանը կապիտալ վերանորոգված է։ Ապահովված է բոլոր կոմունալ հարմարություններով։ Ջեռուցումը կենտրոնացված է, բոլոր սենյակներում տեղադրված են օդորակիչներ։ Տեղադրված է երկաթե դուռ, եվրո պատուհաններ, հատակը ծածկված է մանրահատակով։ Խոհանոցը և անհանգույցնները սալիկապատված են, ապահովված է անհրաժեշտ սանտեխնիկայով։ Ավտոմեքենաների համար հատկացված է ստորգետնյա կայանատեղի։ Մոտակայքում են գտնվում բոլոր անհրաժեշտ խանութները, ժամանցի վայրերը: "
Ե․ Քոչար 2,1 սենյակ,40 մ2, հարկ 6/10 ," Վաճառք - 69,000 $ "," Վաճառվում է 1 ձևափոխված 2 սենյականոց ստուդիո ոճի բնակարան՝ 40 ք.մ. մակերեսով, որը գտնվում է Քաջազնունի և Ե. Քոչար փողոցների խաչմերուկում` 10 հարկանի պանելային շենքի 6-րդ հարկում։ Բնակարանը կապիտալ վերանորոգված է։ Ջեռուցվում է գազի կաթսայի միջոցով։ Սանհանգույցը և խոհանոցը սալիկապատված են: Հատակը ծածկված է պրեսգրանիտով։ Բոլոր սենյակները կահավորված են ժամանակակից և որակյալ կահույքով: Բնակարանն ունի բաց պատշգամբ և խորդանոց: Վաճառվում է ողջ կահույքի և տեխնիկայի հետ միասին: Շքամուտքը ևս կապիտալ վերանորոգված է և վերելակը անխափան գործում է: "
Վարդանանց,2 սենյակ,63 մ2, հարկ 3/10 ," Վաճառք - 105,000 $ "," Վարդանանց փողոցում վաճառվում է 2 սենյականոց հարմարավետ բնակարան վերապլանավորած 3, որի ընդհանուր մակերեսը կազմում է 63 քմ.: Այն գտնվում է 10 հարկանի պանելյաին շենքի 3-րդ հարկում: Բնակարանը կապիտալ վերանորոգված է: Ապահովված է բոլոր կոմունալ հարմարություններով։ Ջեռուցվում է գազի կաթսայի միջոցով: Բոլոր սենյակները և խոհանոցը կահավորված են հարմարավետ և ժամանակակից խոհանոցային կահույքով, հագեցած է տեխնիկայով և սանտեխնիկայով: Մոտակայքում կարող եք գտնել բազմաթիվ խանութներ, ժամանցի և մշակութային կենտրոններ, սուպերմարկետներ, բանկեր: "
Հյուսիսային պող.,5 սենյակ,258 մ2," հարկ 5/8 , նորակառույց "," Վաճառք - 980,000 $ "," Վաճառվում է 5 սենյականոց ընդարձակ բնակարան` Հյուսիսային պողոտայում, 8 հարկանի նորակառույց շենքի 5-րդ հարկում: Բնակարանը կապիտալ վերանորոգված է ժամանակակից ոճով և ունի յուրահատուկ դիզայն։ Ընդհանուր մակերեսը 258 ք.մ. է: Բնակարանը բաղկացած է 5 սենյակներից` հյուրասենյակ, 1 խոհանոց (առանձին), 3 ննջասենյակ , 3 սանհանգույց, 1 աշխատասենյակ: Ունի 3 բաց պատշգամբ` հիանալի տեսարանով, ննջարաններից և աշխատասենյակից առկա է ելք դեպի պատշգամբ: Բնակարանի ջեռուցումն ու հովացումն իրականացվում է կենտրոնացված ֆալկոլային համակարգով, հատակը ծածկված է բամբուկե մանրահատակով: Բնակարանի հետ վաճառվում է ստորգետնյա կայանատեղ: Բնակարանը վաճառվում է խոհանոցի կահույքի և ներկառուցված պահարանների հետ միասին: "
Աբովյան,4 սենյակ,225 մ2," հարկ 6/15 , նորակառույց "," Վաճառք - 630,000 $ "," Թումանյան և Աբովյան փողոցների խաչմերուկում՝ Բրիոնի/Կանալի բրենդային խանութի շենքում, վաճառվում է 4 սենյականոց ընդարձակ և լուսավոր բնակարան, որը գտնվում է 15 հարկանի էլիտար նորակառույց շենքի 6-րդ հարկում։ Ընդհանուր մակերեսը կազմում է 225 քմ.։ Բնակարանը գտնվում է զրոյական վիճակում։ Տեղադրված է երկաթե դուռ, վիտրաժային եվրո պատուհաններ, որոնցից բացվում է տեսարան դեպի Թումանյան և Աբովյան փողոցներ: Ջեռուցման և հովացման համակարգը կենտրոնացված է։ Բաց պատշգամբը բացվում է դեպի Մոսկվա կինոթատրոն, Կասկադ, Հանրապետության հրապարակ։ Շենքի բակն ունի անվտանգության համակարգ, վերելակները սմարթ են։ "
