addr,rooms,ruler,floor,price,descr
Ե. Կողբացի 16,2 սենյակ,45 մ2," հարկ 10/18 , նորակառույց ", Վարձակալություն - 800 $/ամիս ," Եզնիկ Կողբացի փողոցում, քաղաքի լավագույն հատվածում երկարաժամկետ վարձակալության է տրվում 2 սենյականոց մոդեռն ոճի ստուդիո բնակարան՝ 45 քմ մակերեսով, որը գտնվում է 18 հարկանի նորակառույց մոնոլիտ շենքի 10-րդ հարկում: Այն կապիտալ վերանորոգված է, տեղադրված է երկաթե դուռ, եվրո պատուհաններ, հատակը ծածկված է որակյալ լամինատով և սալիկներով։ Սանհանգույցը սալիկապատված է եվրոպական արտադրության սալիկներով և հագեցած է սանտեխնիկայով: Ջեռուցումն իրականացվում է կենտրոնացված համակարգով: Տեղադրված է 2 օդորակիչ: Բնակարանն ունի բաց պատշգամբ` գեղեցիկ տեսարանով: Շենքում գործում է 3 վերելակ, կա շուրջօրյա անվտանգության համակարգ: Բակը բարեկարգ է, առկա է խաղահրապարակ: Մոտակայքում են գտնվում բոլոր անհրաժեշտ խանութներն ու ժամանցի վայրերը: "
"Նալբանդյան 7/1, բն. 85",3 սենյակ,80 մ2," հարկ 10/10 , նորակառույց ", Վարձակալություն - 750 $/ամիս ," Նալբանդյան և Արամի փողոցմերի խաչմերուկում՝ Հանրապետության Հրապարակից քիչ հեռու՝ Սախարովի Հրապարակի մոտ, վարձով է տրվում երեք սենյականոց բնակարան։ Այն գտնվում է 13 հարկանի բնակելի նորակառույց շենքի 2-րդ հարկում։ Վերջերս է ենթարկվել եվրոպական ստանդարտներին համապատասխան վերանորոգման և դեռևս չի բնակեցվել: Տեղադրված է երկաթյա դուռ, հատակը ծածկված է մանրահատակով: Ջեռուցվում է անհատական ջեռուցման համակարգով: Սանհանգույցը պատված է իսպանական սալիկներով: Անցկացված է ինտերնետ կապ: Լի է ներկառուցված պահարաններով թե՛ միջանցքում, թե՛ խոհանոցում: Թաղամասում գործում է 24 ժամյա ջրամատակարարում, բնական գազ: Ավտոմեքենաների համար հատկացված են բացօթյա կայանատեղեր: Վարձակալության ողջ ընթացում Ձեր տրմադրության տակ կլինի ողջ անհրաժեշտ տեխնիկան և կահույքը: Հարևանությամբ կան նաև այլ խանութներ, սրճարաններ, մետրո կայարան, դպրոց և մանկապարտեզ: "
Փ․ Բուզանդ 13,2 սենյակ,60 մ2," հարկ 11/15 , նորակառույց ", Վարձակալություն - 650 $/ամիս ," Վարձակալությամբ կամ օրավարձով է տրվում 2 սենյականոց բնակարան 60 ք.մ. մակերեսով, որը գտնվում է Փոքր կետրոնում՝ Բուզանդ փողոցում՝ 15 հարկանի նորակառույց շենքի 11-րդ հարկում: Բնակարանը կապիտալ վերանորոգված և չբնակեցված է։ Տեղադրված է երկաթյա դուռ, եվրոպատուհաններ, հատակը ծածկված է լամինատով: Ապահովված է շուրջօրյա ջրամատակարարմամբ և գազամատակարարմամբ։ Ջեռուցումը կենտրոնացված է։ Սանհանգույցը և խոհանոցը պատված են սալիկներով, հագեցած է սանտեխնիկայով: Բոլոր սենյակները և խոհանոցը կահավորրված են։ Առկա է կաբելային հեռուստատեսություն և ինտերնետ։ Ավտոմեքենաների համար հատկացված են ստորգետնյա կայանատեղեր: Մոտակայքում են գտնվում բոլոր անհրաժեշտ խանութները և ժամանցի վայրերը։ "
Նալբանդյան 9,4 սենյակ,100 մ2, հարկ 3/5 ," Վարձակալություն - 1,900 $/ամիս "," Օրավարձով է տրվում 4 սենյականոց ընդարձակ բնակարան՝ 100 ք.մ. մակերեսով, որը գտնվում է Նալբանդյան փողոցում՝ Սախարովի հրապարակի հարևանությամբ, 5 հարկանի քարե շենքի 3-րդ հարկում: Այն կապիտալ վերանորոգված է։ Ջեռուցվում է գազի կաթսայի միջոցով, իսկ հովացումը՝ օդորակիչով։ Բնակարանը ապահովված է կահույքով, տեխնիկայով, սպասքով և անկողնային պարագաներով։ Առկա է կաբելային հեռուստատեսություն և ինտերնետ։ Մոտակայքում են գտնվում բոլոր անհրաժեշտ խանութները, հանգստի և ժամանցի վայրեր և այլն։ "
Արամի փողոց 74,3 սենյակ,75 մ2," հարկ 13/20 , նորակառույց ", Վարձակալություն - 900 $/ամիս ," Օրավարձով է տրվում 3 սենյականոց բնակարան՝ 75 ք.մ. մակերեսով, որը գտնվում է Արամի փողոցում՝ Դարգետ սրճարանի շենքում, 20 հարկանի նորակառույց շենքի 13-րդ հարկում: Այն կապիտալ նորոգված է։ Տեղադրված է երկաթե դուռ, եվրո պատուհաններ, հատակը ծածկված է լամինատով: Սանհանգույցը համալրված է անհրաժեշտ սանտեխնիկայով: Ունի բաց պատշգամբ։ Բնակարանը ապահովված է կահույքով, տեխնիկայով, սպասքով և անկողնային պարագաներով։ "
"Արամի փողոց 4/3, բն. 46",3 սենյակ,65 մ2," հարկ 8/12 , նորակառույց ", Վարձակալություն - 750 $/ամիս ," Օրավարձով է տրվում 3 սենյականոց հարմարավետ բնակարան՝ 65 ք.մ. մակերեսով, որը գտնվում է Արամի փողոցում՝ 12 հարկանի նորակառույց շենքի 8-րդ հարկում: Այն կապիտալ վերանորոգված է։ Տեղադրված է երկաթե դուռ, եվրո պատուհաններ, հատակը ծածկված է սալիկով և տաքացվող է: Ջեռուցվում է գազի կաթսայի միջոցով, բոլոր սենյակներում տեղադրված են օդորակիչներ։ Սանհանգույցը սալիկապատված է, հագեցած է սանտեխնիկայով: Ունի բաց պատշգամբ։ Բնակարանը ապահովված է կահույքով և տեխնիկայով։ Մոտակայքում կան բազմաթիվ խանութներ, ժամանցի վայրեր։ Շենքն ունի անվտանգության համակարգ և աշխատակից։ "
Չայկովսկի 34,3 սենյակ,72 մ2," հարկ 2/6 , նորակառույց ", Վարձակալություն - 650 $/ամիս ," Վարձով է տրվում 3 սենյականոց բնակարան՝ 72 ք.մ. մակերեսով, որը գտնվում է Չայկովսկի և Խանջյան փողոցների խաչմերուկում՝ Վերնիսաժի հարևանությամբ, 6 հարկանի շենքի 2-րդ հարկում: Բնակարանը կապիտալ նորոգված է։ Տեղադրված է երկաթյա դուռ, եվրո պատուհաններ, օդորակիչ, հատակը ծածկված է լամինատով: Ջեռուցվում է գազի կաթսայի միջոցով։ Սանհանգույցը և խոհանոցը պատված են սալիկներով, հագեցած է սանտեխնիկայով: Առկա է կաբելային հեռուստատեսություն և ինտերնետ։ Լի է ներկառուցված պահարաններով թե՛ միջանցքում, թե՛ խոհանոցում: "
"Ավագ Պետրոսյան փողոց 4, բն. 24",6 սենյակ,180 մ2, հարկ 3/4 ," Վարձակալություն - 1,000 $/ամիս "," Սայաթ-Նովա և Ա. Պետրոսյան փողոցների խաչմերուկի մոտ, ""Կովկաս"" ռեստորանի հարևանությամբ, 4 հարկանի քարե շենքի նախավերջին հարկում, գտնվում է 6 սենյականոց ընդարձակ բնակարանը` 180 ք.մ մակերեսով: Կապիտալ վերանորոգված, հարմարավետ և լուսավոր բնակարան է: Կահավորված է, համալրված` անհրաժեշտ տեխնիկայով: Լոգասենյակում տեղադրված է ջակուզի: Ջեռուցվում է գազի կաթսայի միջոցով: Անցկացված է ինտերնետ կապ և արբանյակային հեռուստատեսություն: Բակում տեղադրված է երկաթյա ավտոտնակ: Մոտակայքում կա սուպերմարկետ, տարատեսակ ֆիրմային խանութներ, ժամանցի վայրեր, կանգառ և այլն: "
Ե. Կողբացի 16,2 սենյակ,64 մ2," հարկ 17/18 , նորակառույց ", Վարձակալություն - պայման. ," Երկարաժամկետ վարձակալության է տրվում 2 սենյականոց լուսավոր բնակարան` 64 քմ մակերեսով Կողբացի փողոցում, 18 հարկանի նորակառույց մոնոլիտ շենքի 17-րդ հարկում. Բնակարանը կապիտալ վերանորոգված է, ջեռուցումն իրականացվում է կենտրոնացված համակարգով, տեղադրված են եվրո պատուհաններ, 2 օդորակիչ, հատակը ծածկված է լամինատով և սալիկներով։ Սանհանգույցը սալիկապատված է եվրոպական արտադրության սալիկներով, ապահովված է բարձրորակ տեխնիկայով, ունի բաց պատշգամբ, որտեղից բացվում է գեղեցիկ տեսարան դեպի քաղաք։ Բնակարանը կահավորված է և հագեցած է ժամանակակից կենցաղային տեխնիկայով և բոլոր պարագաներով։ Շենքն ունի 3 վերելակ և անվտանգության համակարգ։ Մոտակայքում են գտնվում բանկերը, դպրոցները, խանութները, սրճարաններն ու ժամանցի վայրերը։ "
Եկմալյան 1/1,4 սենյակ,145 մ2," հարկ 15/18 , նորակառույց "," Վարձակալություն - 3,000 $/ամիս "," Օրավարձով կամ երկարաժամկետ վարձակալության է տրվում 4 սենյականոց շքեղ եվրո վերանորոգումով և նրբաճաշակ գույներով բնակարան ընդհանուր` 145 ք.մ. մակերեսով, որը գտնվում է Եկմալյան փողոցում՝ 18 հարկանի նորակառույց մոնոլիտ շենքի 15-րդ հարկում: Բնակարանն ապահովված է կահույքով և տեխնիկայով, համալրված բոլոր անհրաժեշտ պարագաներով: Տեղադրված է գազի կաթսա, 3 օդորակիչներ, հատակը ծածկված է լամինատով և կերամոգրանիտով, որը նաև տաքացվում է: Ունի 2 սանհանգույց, որից մեկը կից է ննջասենյակին: Սանհանգույցները սալիկապատված են և հագեցած անհրաժեշտ սանտեխնիկայով: Առկա են 2 բացօթյա պատշգամբներ` գեղատեսիլ երևանյան տեսարանով: Կա ինտերնետ և կաբելային հեռուստատեսություն: Շենքն ունի 2 վերելակ, ապահովված է անվտանգության և տեսահսկման համակարգերով: Մոտակայքում է գտնվում Մալիբու նորակառույց այգին, տարբեր խանութներ և ժամանցի վայրեր: "
"Կոմիտասի պող. 20, բն. 7",1 սենյակ,31 մ2, հարկ 2/5 , Վարձակալություն - 400 $/ամիս ," Կոմիտաս և Վաղարշյան փողոցների խաչմերուկում՝ ""Արևելյան խոհանոց"" ռեստորանի մոտ, երկարաժամկետ վարձակալությամբ և օրավարձով է տրվում մեկը դարձրած երկու սենյականոց բնակարան` 31 ք.մ. մակերեսով, որը գտնվում է հինգ հարկանի քարե շենքի երկրորդ հարկում։ Այն կապիտալ վերանորոգված է, տեղադրված է օդորակիչ: Սանհանգույցը սալիկապատ է և հագեցած սանտեխնիկայով: Սենյակները կահավորված են ժամանակակից և հարմարավետ կահույքով։ Վարձակալության ընթացքում Ձեր տրամադրության տակ կլինի ողջ կահույքը և տեխնիկան։ Ունի ինտերնետ, արբանյակային և կաբելային TV-ներն առկա են։ "
Հյուսիսային պող.,3 սենյակ,180 մ2," հարկ 14/16 , նորակառույց "," Վարձակալություն - 2,800 $/ամիս "," Տրվում է վարձով 3 սենյականոց յուրահատուկ դիզայնով, գեղեցիկ, նրբաճաշակ և նմանը չունեցող ընդարձակ բնակարան՝ 180 ք.մ. մակերեսով, որը գտնվում է քաղաքի կենտրոնում՝ Հյուսիսային պողոտայում՝ Օպերայի և Կարապի լճի հարևանությամբ, 16 հարկանի նորակառույց շենքի 14-րդ հարկում: Բնակարանը կապիտալ եվրո նորոգված է՝ համապատասխան վերջին եվրոպական ստանդարտների։ Բոլոր սենյակների դռները և պատուհանները վիտաժային են, հատակը ամբողջությամբ պատված է բնական քարով: Ջեռուցման և հովացման համակարգը կենտրոնացված է։ Լոգասենյակները և սանհանգույցները սալիկապատված են, ինչպես նաև հատակները տաքացվող են։ Բոլոր սենյակները և խոհանոցը կահավորված են ժամանակակից և ինքնատիպ կահույքով, լի է ներկառուցված պահարաններով։ Ունի առանձին լվացքասենյակ, 3 կողմից բաց պատշգամբներ, որոնցից բացվում է հիանալի տեսարաններ դեպի քաղաքի տարբեր հատվածներ։ Ննջասենյակներից մեկում տեղադրված է ջակուզի անմիջապես վիտրաժային պատուհանների դիմաց, որը հնարավորություն է տալիս հիանալի քաղաքի տեսարանով։ Ավտոմեքենաների համար հատկացված է ստորգետնյա կայանատեղ։ "
Բայրոնի,4 սենյակ,200 մ2," հարկ 3/6 , նորակառույց "," Վարձակալություն - 3,000 $/ամիս "," Վարձով է տրվում 4 սենյականոց ընդարձակ բնակարան՝ 200 ք.մ. մակերեսով, որը գտնվում է Բայրոն և Մոսկովյան փողոցների խաչմերուկում՝ 6 հարկանի քարե շենքի 3-րդ հարկում: Այն կապիտալ եվրո վերանորոգված և չբնակեցված է։ Տեղադրված է երկաթե դուռ, եվրո պատուհաններ, նախասրահի և խոհանոցի հատակը ծածկված է սալիկով, իսկ ննջասենյակներում և հյուրասենյակում` մանրահատակով: Ջեռուցվում է գազի կաթսայի միջոցով, տեղադրված է նաև օդորակիչ։ Ունի ընդարձակ բաց պատշգամբ` դեպի փողոց բացվող։ Բնակարանն ունի նաև ստորգետնյա կայանատեղ` 2 մեքենայի համար նախատեսված: "
Տերյան,2 սենյակ,38 մ2, հարկ 3/5 , Վարձակալություն - 700 $/ամիս ," Երկարաժամկետ վարձակալությամբ կամ օրավարձով է տրվում 2 սենյականոց բնակարան՝ 38 ք.մ. մակերեսով, որը գտնվում է Տերյան և Թումանյան փողոցնեի խաչմերուկում՝ Կարապի լճի դիմաց, 5 հարկանի քարե շենքի 3-րդ հարկում: Այն կապիտալ վերանորոգված է։ Տեղադրված է երկաթե դուռ, եվրո պատուհաններ, օդորակիչ, հատակը ծածկված է պրեսգրանիտով: Ջեռուցվում է գազի կաթսայի միջոցով։ Սանհանգույցը պատված է սալիկներով, հագեցած է սանտեխնիկայով: Ունի բաց պատշգամբ՝ դեպի Կարապի լիճ նայող։ Բնակարանը ապահովված է կահույքով, տեխնիկայով, սպասքով և անկողնային պարագաներով։ Մուտքը բարեկարգ է։ Մոտակայքում են գտնվում բոլոր տեսակի ժամանցի և հանգստի վայրերը։ "
Տերյան,3 սենյակ,100 մ2, հարկ 3/5 ," Վարձակալություն - 1,000 $/ամիս "," Երկարաժամկետ վարձակալությամբ կամ օրավարձով է տրվում 3 սենյականոց բնակարան՝ 100 ք.մ. մակերեսով, որը գտնվում է Տերյան և Թումանյան փողոցների խաչմերուկում՝ Կարապի լճի և Օպերայի հարևանությամբ, 5 հարկանի քարե շենքի 3-րդ հարկում: Այն կապիտալ վերանորոգված է։ Տեղադրված է երկաթե դուռ, եվրո պատուհաններ, հատակը ծածկված է պրեսգրանիտով: Ջեռուցվում է գազի կաթսայի միջոցով, բոլոր սենյակներում տեղադրված են օդորակիչներ։ Սանհանգույցը և խոհանոցը պատված են սալիկներով, հագեցած է սանտեխնիկայով: Բնակարանը ապահովված է կահույքով և տեխնիկայով։ Առկա է կաբելային հեռուստատեսություն և ինտերնետ։ "
Ամիրյան փողոց,4 սենյակ,180 մ2," հարկ 7/12 , նորակառույց "," Վարձակալություն - 1,000 $/ամիս "," Ամիրյան և Զաքյան փողոցների խաչմերուկում՝ Հանրապետության հրապարակի մոտ վարձով է տրվում 4 սենյականոց բնակարան՝ 180 ք.մ. մակերեսով, որը գտնվում է 12 հարկանի նորակառույց շենքի 7-րդ հարկում: Այն կապիտալ վերանորոգված է։ Տեղադրված է երկաթե դուռ, եվրո պատուհաններ, օդորակիչ, հատակը ծածկված է մանրահատակով։ Բնակարանն ունի լայնարձակ բաց պատշգամբ։ Ջեռուցվում է գազի կաթսայի միջոցով։ Խոհանոցը և սանհանգույցը պատված են սալիկներով, հագեցած է սանտեխնիկայով: Բնակարանը կահավորված է և ապահովված անհրաժեշտ տեխնիկայով։ Մոտակայքում են գտնվում բոլոր խանութները, ժամանցի վայրերը՝ սրճարաններ, ռեստորաններ։ "
Փ․ Բուզանդ 17,2 սենյակ,50 մ2," հարկ 8/15 , նորակառույց ", Վարձակալություն - 700 $/ամիս ," Վարձակալության է տրվում 2 սենյականոց հարմարավետ բնակարան՝ 50 ք.մ. մակերեսով, որը գտնվում է Բուզանդ և Աբովյան փողոցների խաչմերուկում՝ 15 հարկանի նորակառույց շենքի 8-րդ հարկում։ Բնակարանը եվրո նորոգված է։ Ջեռուցման և հովացման համակարգը կենտրոնացված է։ Սանհանգույցը հագեցած է սանտեխնիկայով: Բնակարանը կահավորված է և ապահովված անհրաժեշտ տեխնիկայով, սպասքով և անկողնային պարագաներով։ Կա կաբելային հեռուստատեսություն և ինտերնետ։ Մոտակայքում են գտնվում բոլոր հանգստի և ժամանցի վայրերը։ "
Արամի փողոց,2 սենյակ,70 մ2," հարկ 9/14 , նորակառույց ", Վարձակալություն - 800 $/ամիս ," Վարձակալությամբ կամ օրավարձով է տրվում 2 սենյականոց բնակարան՝ 70 ք.մ. մակերեսով, որը գտնվում է Արամի փողոցում` նորակառույց այգու դիմաց, 14 հարկանի նորակառույց շենքի 9-րդ հարկում: Ջեռուցում և հովացումը անհատական է։ Սանհանգույցը համալրված է անհրաժեշտ սանտեխնիկայով: Բնակարանը ապահովված է կահույքով և համալրված ժամանակակից տեխնիկայով։ Ունի ընդարձակ բաց պատշգամբ, որից բացվում է գեղեցիկ տեսարան: Բնակարանը գտնվում է քաղաքի լավագույն հատվածներից մեկում` անմիջապես հարևանությամբ կա ռեստորան, սրճարան, ինչպես նաև մի քանի քայլ այն կողմ` բժշկական հաստատություն, դպրոց և այլ ժամանցի վայրեր: "
Հյուսիսային պող.,3 սենյակ,135 մ2," հարկ 3/8 , նորակառույց "," Վարձակալություն - 1,500 $/ամիս "," Երկարաժամկետ վարձակալությամբ և օրավարձով է տրվում 3 սենյականոց յուրահատուկ դիզայնով ինքնատիպ բնակարան,որի ընդհանուր մակերեսը կազմում է 135 ք.մ մակերեսով, որը գտնվում է Հյուսիսային Պողոտայի վրա՝ Օպերայի թատրոնի հարևանությամբ, 8 հարկանի նորակառույց շենքի 3-րդ հարկում: Բնակարանը վերանորոգված է եվրոպական ստանդարտներին համապատասխան: Ունի գեղեցիկ և նրբաճաշակ կահավորանք, հագեցած է անհրաժեշտ տեխնիկայով: Ապահովված է բոլոր կոմունալ հարմարություններով: Ջեռուցում և հովացումը կենտրոնացված է: Բնակարանն ունի երկու բաց պատշգամբ, որից մեկը բացվում է դեպի Հյուսիսային պողոտա։ Ավտոմեքենաների համար հատկացված է ստորգետնյա կայանատեղ։ "
Փ․ Բուզանդ 91,2 սենյակ,80 մ2," հարկ 8/15 , նորակառույց "," Վարձակալություն - 1,200 $/ամիս "," Փ. Բուզանդի փողոցում երկարաժամկետ վարձակալության է տրվում 2 սենյականոց գեղեցիկ կահավորված լուսավոր բնակարան՝ 80 ք.մ. մակերեսով, որը գտնվում է 15 հարկանի նորակառույց շենքի 8-րդ հարկում: Բնակարանը կապիտալ եվրո նորոգված է՝ համապատասխան եվրոպական ստանդարտների։ Տեղադրված է երկաթե դուռ, եվրո պատուհաններ, հատակը ծածկված է որակյալ լամինատով և պրեսգրանիտով: Ունի ջեռուցման և հովացման կենտրոնացված համակարգ: Սանհանգույցը սալիկապատված է, հագեցած անհրաժեշտ սանտեխնիկայով: Բոլոր սենյակները և խոհանոցը կահավորված են ժամանակակից կահույքով, լի է ներկառուցված պահարաններով։ Ունի բացօթյա պատշգամբ դեպի այգի տեսարանով: Շենքն ունի 2 վերելակ, անվտանգության համակարգ: Մոտակայքում է գտնվում նորակառույց այգին, բազում խանութներ և ժամանցի վայրեր: "
