addr,rooms,ruler,floor,price,descr
Ձորափի 40,4 սենյակ,180 մ2," հարկ 9/16 , նորակառույց "," Վաճառք - 410,000 $ "," Վաճառվում է կամ վարձակալության է տրվում 4 սենյականոց գրեթե չբնակեցված բնակարան՝ 180 քմ մակերեսով, որը գտնվում է 16 հարկանի նորակառույց մոնոլիտ շենքի 9-րդ հարկում: Բնակարանը երկկողմանի է, ունի գեղեցիկ լուսավորություն, 2 կողմից բաց պատշգամբներ` Հրազդանի կիրճի և քաղաքի հիասքանչ տեսարանով: Բոլոր սենյակները և խոհանոցը ժամանակակից ոճով կահավորված են, դիզայներական լուծումներով կապիտալ վերանորոգված: Տեղադրված է երկաթե դուռ, եվրո պատուհաններ, հատակը ծածկված է որակյալ լամինատով և կերամոգրանիտով։ Ջեռուցումն իրականացվում է կենտրոնացված համակարգով, տեղադրված են օդորակիչներ: Առկա է 3 սանհանգույց, որոնք սալիկապատված են եվրոպական արտադրության սալիկներով և հագեցած են բարձրորակ սանտեխնիկայով: Շենքն ապահովված է անվտանգության համակարգով: Առկա է 3 մեքենայի համար նախատեսված ավտոկայանատեղի: Վաճառվում է կահույքի հետ միասին: "
Մաշտոցի պողոտա,2 սենյակ,45 մ2, հարկ 2/4 ," Վաճառք - 155,000 $ "," Վաճառվում է 2 սենյականոց բնակարան՝ 45 ք.մ. մակերեսով, որը գտնվում է Մաշտոցի պոցոտայում՝ Նաիրի կինոթատրոնի հարևանությամբ, 4 հարկանի քարե շենքի 2-րդ հարկում: Բնակարանը կապիտալ եվրո վերանորոգված է և չբնակեցված։ Ջեռուցվում է գազի կաթսայի միջոցով, տեղադրված է օդորակիչ, հատակը ծածկված է լամինատով։ Սանհանգույցը և խոհանոցը պատված են սալիկներով, հագեցած է սանտեխնիկայով: Առաստաղի բարձրությունը 3 մետր է։ Ողջ կահույքն ու տեխնիկան նոր է։ Շենքը շքամուտքով է։ "
Ն. Զարյան,2 սենյակ,62 մ2," հարկ 15/17 , նորակառույց "," Վաճառք - 97,000 $ "," Վաճառվում է 2 սենյականոց լուսավոր բնակարան՝ 62 ք.մ. մակերեսով, որը գտնվում է Ն.Զարյան փողոցում՝ 17 հարկանի նորակառույց էլիտար շենքի 15-րդ հարկում: Բնակարանը կապիտալ վերանորոգված է որակյալ նյութերով: Ջեռուցումը անհատական է։ Սանհանգույցը պատված է սալիկներով, հագեցած է սանտեխնիկայով: Բնակարանն ունի բաց պատշգամբ, որից բացվում է հիանալի տեսարան դեպի քաղաքը: Շենքն ունի շուրջօրյա անվտանգության համակարգ, 3 վերելակ, բարեկարգ բակ և խաղահրապարակ։ Վաճառվում է ողջ կահույքի և տեխնիկայի հետ միասին: "
Մոլդովական,3 սենյակ,79 մ2, հարկ 1/9 ," Վաճառք - 75,000 $ "," Վաճառվում է 3 սենյականոց բնակարան` 79 քմ մակերեսով, որը գտնվում է Մոլդովական փողոցում՝ 9 հարկանի պանելային շենքի 1-ին հարկում: Բնակարանը հիմնովին վերանորոգված է, տեղադրված է անհատական ջեռուցման համակարգ և եվրո պատուհաններ, հատակը սալիկապատված է, սանհանգույցը սալիկապատված է և հագեցած բարձրորակ սանտեխնիկայով: Կա տնտեսական պատշգամբ և խորդանոց՝ որի մուտքը խոհանոցից է: Շենքն ունի անխափան վերելակ: Մոտակայքում կան խանութներ, դպրոց, մանկապարտեզ, զբոսայգի և տարբեր ժամանցի վայրեր: "
Նոր Արեշի 14-րդ,3 սենյակ,118 մ2, հարկ 3/3 ," Վաճառք - 109,000 $ "," Վաճառվում է 3 սենյականոց բնակարան՝118 ք.մ. մակերեսով, որը գտնվում է Նոր Արեշի 14-րդ փողոցում` Երևան սիթիի հարևանությամբ, 3 հարկանի մոնոլիտ շենքի 3-րդ հարկում: Բնակարանը կապիտալ վերանորոգված է։ Տեղադրված է երկաթյա դուռ, եվրո պատուհաններ, հատակը ծածկված է սալիկով։ Ջեռուցվում է գազի կաթսայի միջոցով։ Սանհանգույցը և խոհանոցը սալիկապատված են, սանհանգույցը հագեցած է սանտեխնիկայով: "
Սիսակյան,3 սենյակ,80 մ2, հարկ 1/4 ," Վաճառք - 70,000 $ "," Վաճառվում է 3 սենյականոց լուսավոր բնակարան` 80 քմ մակերեսով, որը գտնվում է Սիսակյան և Արզումանյան փողոցների խաչմերուկում` 4 հարկանի քարե շենքի 1-ին հարկում: Բնակարանը կապիտալ վերանորոգված է, տեղադրված է անհատական ջեռուցման և օդորակման համակարգ, եվրո պատուհաններ, հատակը ծածկված է մանրահատակով և եվրոպական արտադրության բարձրորակ սալիկներով: Սանհանգույցը և խոհանոցը սալիկապատված են, սանհանգույցը հագեցած է անհրաժեշտ սանտեխնիկայով, խոհանոցը կահավորված է: Առկա է քարե ավտոտնակ: Մոտակայքում կան տարբեր խանութներ, դպրոց, մանկապարտեզ և ժամանցի օբյեկտներ: Վաճառվում է կահույքի և տեխնիկայի հետ միասին: "
Մաշտոցի պողոտա 7,3 սենյակ,80 մ2, հարկ 2/5 ," Վաճառք - 160,000 $ "," Վաճառվում է 3 սենյականոց հարմարավետ բնակարան՝ 80 ք.մ. մակերեսով, որը գտնվում է Մեսրոպ Մաշտոցի պողոտայում՝ Սարյան փողոցի խաչմերուկի հատվածում, 5 հարկանի քարե շենքի 2-րդ հարկում: Բնակարանը կապիտալ վերանորոգված է։ Ջեռուցվում է գազի կաթսայի միջոցով, տեղադրված է նաև օդորակիչ։ Պատուհանները փոխված են, հատակը ծածկված է մանրահատակով: Սանհանգույցը և խոհանոցը սալիկապատված են: Խոհանոցում և միջանցքում առկա են ներկառուցված պահարաններ: Շենքն ունի վերելակ և բարեկարգ բակ` խաղահրապարակով: Մոտակայքում են գտնվում բոլոր անհրաժեշտ խանութները, ժամանցի վայրերը: "
Հր. Քոչար,3 սենյակ,126 մ2, հարկ 7/14 ," Վաճառք - 195,000 $ "," Վաճառվում է 3 սենյականոց լուսավոր բնակարան` 126 քմ մակերեսով, որը գտնվում է Հր. Քոչար փողոցում՝ 14 հարկանի շենքի 7-րդ հարկում: Բնակարանը կապիտալ վերանորոգված է և չբնակեցված, տեղադրված է ջեռուցման և օդորակման անհատական համակարգ, եվրո պատուհաններ, հատակը ծածկված է բարձրորակ լամինատով և պրեսգրանիտով: Երկու սանհանգույցները սալիկապատված են եվրոպական արտադրության սալիկներով և հագեցած են սանտեխնիկայով: Բնակարանը կահավորված է ժամանակակից կահավորանքով և ապահովված է կենցաղային տեխնիկայով: Ունի գեղեցիկ տեսարանով 2 բացօթյա պատշգամբ: Շենքում գործում է 2 վերելակ, կա անվտանգության համակարգ: Շենքից ոչ հեռու գտնվում է Կոմիտասի շուկան, Լամբադա կամուրջը, բազմազան խանութներ և ժամանցի վայրեր: Բնակարանը վաճառվում է կահույքի և տեխնիկայի հետ միասին: "
Հանրապետության 82,3 սենյակ,71 մ2, հարկ 3/4 ," Վաճառք - 160,000 $ "," Հանրապետության և Թումանյան փողոցների խաչմերուկում՝ Կովկաս Պանդոկի հարևանությամբ, վաճառվում է 3 սենյականոց բնակարան՝ 71.3 ք.մ. մակերեսով, որը գտնվում է 4 հարկանի քարե շենքի բնակելի 3-րդ հարկում։ Բնակարանը կապիտալ վերանորոգված է։ Տեղադրված է երկաթե դուռ, եվրո պատուհաններ, օդորակիչ, հատակը ծածկված է որակյալ մանրահատակով և ջեռուցվում է մասնակի։ Խոհանոցը և սանհանգույցը պատված են սալիկներով, հագեցած է սանտեխնիկայով, առկա է 2 ջրի բաք: Ունի բաց պատշգամբ։ Բնակարանը վաճառվում է ողջ գույքի և տեխնիկայի հետ միասին` հավելավճարով։ "
Փ․ Բուզանդ,3 սենյակ,90 մ2," հարկ 10/16 , նորակառույց "," Վաճառք - 310,000 $ "," Վաճառվում կամ վարձով է տրվում 3 սենյականոց շատ նրբաճաշակ և ժամանակակից դիզայնով բնակարան` 90 ք.մ. մակերեսով, որը գտնվում է Բուզանդ փողոցում` նորակառույց այգու հարևանությամբ, 16 հարկանի նորակառույց շենքի 10-րդ հարկում։ Բնակարանը կապիտալ եվրո նորոգված է, ողջ կահույքը և տեխնիկան նոր է, բարձրորակ և շատ հարմարավետ: Ջեռուցում և հովացումը կենտրոնացված է։Սանհանգույցը սալիկապատված է և հագեցած է սանտեխնիկայով: Բնակարանն ունի բաց պատշգամբ: Մոտակայքում են գտնվում բոլոր անհրաժեշտ խանութները, ժամանցի վայրերը։ Բնակարանը վաճառվում է կահույքի և տեխնիկայի հետ միասին: "
Զ. Անդրանիկ,1 սենյակ,48 մ2, հարկ 2/9 ," Վաճառք - 45,000 $ "," Զորավար Անդրանիկի փողոցում` Երևան Սիթի սուպերմարկետի մոտ, վաճառվում է 1 ձևափոխված 2 սենյականոց բնակարան` 48 ք.մ մակերեսով, որը գտնվում է 9 հարկանի պանելային շենքի 2-րդ հարկում: Բնակարանը վերանորոգված է: Հատակը ծածկված է լամինատով, տեղադրված են եվրո պատուհաններ, մուտքի երկաթե դուռ: Խոհանոցը պատված է սալիկներով: Բոլոր սենյակները և խոհանոցը կահավորված են, ապահովված են կահույքով ու տեխնիկայով։ Մոտակայքում են գտնվում «ՓԻ-ՍԻ ԷԼԵԿՏՐՈՆԻԿՍ» խանութ սրահը, կա դեղատուն և մթերային խանութ: Բնակարանը վաճառվում է մասնակի կահույքով: "
Վարդաշենի 3-րդ,2 սենյակ,49 մ2, հարկ 1/4 ," Վաճառք - 45,000 $ "," էրեբունի համայնքում` Վարդաշենի 3-րդ փողոցում, վաճառվում է 2 սենյականոց բնակարան` 49 ք.մ. մակերեսով, որը գտնվում է 4 հարկանի քարե շենքի 1-ին հարկում: Այն կապիտալ վերանորոգված է, տեղադրված է երկաթյա մուտքի դուռ, եվրոպատուհաններ, հատակը ծածկված է որակյալ լամինատով: Սանհանգույցը պատված է սալիկներով, հագեցած սանտեխնիկայով: Շենքը գազիֆիկացված չէ: Ունի ստուդիո խոհանոց: Բոլոր սենյակները և խոհանոցը կահավորված են։ Վաճառվում է գույքի և տեխնիկայի հետ միասին: "
Մաշտոցի պողոտա,3 սենյակ,89 մ2, հարկ 3/5 ," Վաճառք - 180,000 $ "," Մաշտոցի պողոտայում, Սարյանի այգու և Օպերայի հարևանությամբ վաճառվում է 3 սենյականոց բնակարան 89 ք.մ. մակերեսով, որը գտնվում է 5 հարկանի` ստալինյան նախագծով կառուցված քարե շենքի 3-րդ հարկում: Ունի բարձր առաստաղ: Արտաքին պատերն ու տանիքը բետոնածածկ են: Բնակարանն ունի հին վերանորոգում։ Սանհանգույցը հին սալիկապատված է: Հատակը ծածկված է մանրահատակով: Բոլոր սենյակները և խոհանոցը կահավորված են։ Ավտոմեքենաների համար բակում կան բացօթյա կայանատեղեր: Մոտակայքում են գտնվում բոլոր խանութները, բանկերը, տրանսպորտի կանգառները, սրճարաններն ու ժամանցի վայրերը։ "
Արամի փողոց 72,3 սենյակ,138 մ2," հարկ 13/14 , նորակառույց "," Վաճառք - 505,000 $ "," Արամի փողոցում` Մալիբու այգու հարևանությամբ, վաճառվում է կամ վարձակալության է տրվում 3 սենյականոց ընդարձակ և լուսավոր բնակարան, որի ընդհանուր մակերեսը կազմում է 138 քմ: Այն գտնվում է 14 հարկանի նորակառույց մոնոլիտ շենքի 13-րդ հարկում: Բնակարանը կապիտալ վերանորոգված է, կահավորված է հարմարավետ և բարձրարժեք կահույքով, համալրված է անհրաժեշտ տեխնիկայով: Տեղադրված է անհատական ջեռուցման և հովացման համակարգ: Ննջասենյակներից մեկում առկա է զգեստասենյակ և սանհանգույց: Սանհանգույցները սալիկապատված են եվրոպական արտադրության սալիկներով, հագեցած են սանտեխնիկայով: Բնակարանն ունի բաց պատշգամբ` մուտք խոհանոցից ու հյուրասենյակից, որից բացվում է տեսարան դեպի այգի: Շենքն ունի 2 վերելակ, անվտանգության համակարգ: Բակում կա բացօթյա ավտոկայանատեղի: Ամիջապես շենքի հարևանությամբ տեղակայված են տարբեր խանութներ, ժամանցի կենտրոններ, սրճարաններ, բանկեր և այլն: Վաճառվում է ամբողջ կահույքի և տեխնիկայի հետ միասին: "
Գ. Նժդեհ,2 սենյակ,61 մ2, հարկ 4/4 ," Վաճառք - 51,000 $ "," Գարեգին Նժդեհ փողոցում` շուկայի հարևանությամբ` 1-ին գծի վրա վաճառվում է 2 սենյականոց արևկող բնակարան` 61 քմ. մակերեսով, որը գտնվում է 4 հարկանի քարե` ստալինյան նախագծով կառուցված շենքի 4-րդ հարկում: Բնակարանը գտնվում է պետական վիճակում: Տեղադրված է մուտքի երկաթե դուռ, հատակը ծածկված է մանրահատակով: Սանհանգույցը հին սալիկապատ է: Տեղադրված է ջրատաքացուցիչ։ Ունի 3 բացօթյա պատշգամբ, որից 2-ը ֆրանսիական պատշգամբներ են: Անմիջապես հարևանությամբ կան խանութներ, կանգառ, բանկեր, ուսումնական հաստատություններ: "
Ֆուչիկ,2 սենյակ,58 մ2, հարկ 3/4 ," Վաճառք - 70,000 $ "," Վաճառվում է 2 ձևափոխված 3 սենյականոց բնակարան` 58 ք.մակերեսով, որը գտնվում է Ֆուչիկ և Մարգարյան փողոցների խաչմերուկում` 4 հարկանի քարե շենքի 3-րդ հարկում: Բնակարանը կապիտալ վերանորոգված է, տեղադրված է եվրո պատուհաններ, հատակը ծածկված է լամինատով և սալիկով, սանհանգույցը պատված է սալիկներով, հագեցված է սանտեխնիկայով: Ջեռուցվում է գազի կաթսայի միջոցով: Բնակարանը վաճառվում է կահույքի և տեխնիկայի հետ միասին: "
Վ. Սարգսյան,5 սենյակ,278 մ2," հարկ 5/11 , նորակառույց ", Վաճառք - պայման. ," Վաճառվում է 5 սենյականոց դուպլեքս բնակարան 278 ք.մ. մակերեսով, որը գտնվում է Վ.Սարգսյան փողոցում՝ Պիացցա Գռանդե նորակառույց 11 հարկանի շենքի 5-րդ և 6-րդ հարկերում: Բնակարանը մասնակի վերանորոգված է։ Տեղադրված է երկաթյա դուռ, եվրոպատուհաններ, օդորակիչներ, հատակը ծածկված է մանրահատակով։ Ջեռուցվում է գազի կաթսայի միջոցով։ Սանհանգույցը և խոհանոցը պատված են սալիկներով, հագեցած է սանտեխնիկայով։ Խոհանոցը կահավորված է։ Ունի բաց պատշգամբ, որից բացվում է գեղեցիկ տեսարան դեպի Հանրապետության հրապարակ։ Շենքն ունի մարզասրահ, շոքեբաղնիք, լողավազան։ Շենքում գործում է նաև անվտանգության համակարգ, առաջին հարկում տեղակայված են սրճարաններ, էսթետիկ կենտրոններ և բանկեր։ Բնակարանի գինն իր մեջ ներառում է ստորգետնյա կայանատեղ` 1 մեքենայի համար նախատեսված: "
Գյուրջյան,6 սենյակ,170 մ2, հարկ 5/5 ," Վաճառք - 135,000 $ "," Վաճառվում է 6 սենյականոց դուպլեքս բնակարան՝ 170 ք.մ. մակերեսով, որը գտնվում է Նոր Նորք 3-րդ զանգվածի Գյուրջյան փողոցում` թիվ 14 պոլիկլինիկայի հարևանությամբ , 5 հարկանի քարե շենքի 5-րդ և 6-րդ հարկերում: 5-րդ հարկի մակերեսը 86 ք.մ. է, իսկ 6-րդ հարկինը` 84, առաստաղի բարձրությունը 2,75 մ. է, ունի բաց պատշգամբ: Բնակարանը կապիտալ վերանորոգված է։ Տեղադրված է երկաթե դուռ, եվրո պատուհաններ, հատակը ծածկված է մանրահատակով: Ջեռուցվում է գազի կաթսայի միջոցով։ Սանհանգույցը պատված է սալիկներով և հագեցած է սանտեխնիկայով: Բնակարանի հետ վաճառվում է քարե ավտոտնակ` նախատեսված 2 մեքենայի համար: "
Պ. Սևակ,2 սենյակ,72 մ2," հարկ 2/14 , նորակառույց "," Վաճառք - 92,000 $ "," Վաճառվում է 2 սենյականոց բնակարան՝ 72 ք.մ. մակերեսով, որը գտնվում է Պ.Սևակ փողոցում՝ սրտաբանական հիվանդանոցի մոտ, 14 հարկանի նորակառույց շենքի 2-րդ հարկում: Բնակարանը կապիտալ վերանորոգված է։ Տեղադրված է երկաթե դուռ, եվրո պատուհաններ, հատակը ծածկված է լամինատով և պրեսգրանիտով։ Ջեռուցվում է գազի կաթսայի միջոցով։ Սանհանգույցը սալիկապատված է և հագեցած է սանտեխնիկայով: Բնակարանն ունի բաց պատշգամբ։ Առաստաղի բարձրությունը 3 մետր է: Հնարավոր է վաճառք կահույքի հետ միասին` հավելավճարով: "
Դավթաշեն 4-րդ թաղ.,3 սենյակ,97 մ2, հարկ 6/9 ," Վաճառք - 100,000 $ "," Վաճառվում կամ վարձով է տրվում 3 սենյականոց բնակարան Դավթաշեն 4-րդ թաղամասում` N 196 դպրոցի մոտակայքում, 9 հարկանի պանելային շենքի 6-րդ հարկում: Բնակարանը կապիտալ եվրո վերանորոգված է։ Ընդհանուր մակերեսը 97.2 քմ է: Տեղադրված է երկաթե դուռ, եվրո պատուհաններ, օդորակիչ, հատակը ծածկված է կաղնե մանրահատակով: Ջեռուցվում է գազի կաթսայի միջոցով: Սանհանգույցը սալիկապատված է և ապահովված է սանտեխնիկայով: Վաճառվում է խոհանոցի կահույքի և ներկառուցված պահարանների հետ միասին: Մոտակայքում են գտնվում բոլոր խանութները, դպրոց, մանկապարտեզ: "
Հյուսիսային պող.,3 սենյակ,192 մ2, հարկ 3/10 ," Վաճառք - 990,000 $ "," Վաճառվում է 3 սենյականոց շքեղ վերանորոգված բնակարան ընդհանուր` 192 ք.մ. մակերեսով, որը գտնվում է Հյուսիսային պողոտայում՝ 10 հարկանի նորակառույց շենքի 3-րդ հարկում: Բնակարանն ունի նրբաճաշակ ինտերյեր, բոլոր սենյակները կահավորված են թանկարժեք կահույքով և համալրված ժամանակակից տեխնիկայով։ Ջեռուցման և հովացման համակարգը կենտրոնացված է։ Հատակը ծածկված է մանրահատակով, երեք սանհանգույցները սալիկապատված են և ապահովված անհրաժեշտ սանտեխնիկայով: Բացօթյա պատշգամբները բացվում են դեպի Հյուսիսային պողոտա։ Շենքն ունի անվտանգության համակարգ: Մոտակայքում են գտնվում բոլոր անհրաժեշտ խանութները և ժամանցի վայրերը։ Վաճառվում է կահույքի և տեխնիկայի հետ միասին: "
Ն. Զարյան,4 սենյակ,150 մ2," հարկ 3/18 , նորակառույց "," Վաճառք - 290,000 $ "," Վաճառվում է 4 սենյականոց ընդարձակ բնակարան՝ 150 ք.մ. մակերեսով, որը գտնվում է Ն.Զարյան փողոցում՝ 18 հարկանի նորակառույց շենքի 3-րդ հարկում: Բնակարանը կապիտալ եվրո նորոգված է, խոհանոցը առանձին է։ Ունի ընդարձակ հյուրասենյակ և նախասրահ։ Հատակը ծածկված է մանրահատակով։ Բնակարանը ձեռուցվում է գազի կաթսայի միջոցով, իսկ հովացումը կատարվում է օդորակիչներով։ Սանհանգույցները պատված են սալիկներով, հագեցած են որակյալ սանտեխնիկայով: Բնակարանն ունի 2 բաց պատշգամ։ Միջանցքը լի է ներկառուցված պահարաններով։ Բնակարանն ունի հիանալի տեսարան։ Շենքն ունի շուրջօրյա անվտանգության համակարգ, բարեկարգ բակ և խաղահրապարակ։ "
Տիգրան Մեծ պող.,3 սենյակ,85 մ2, հարկ 2/5 ," Վաճառք - 105,000 $ "," Վաճառվում է 3 սենյականոց արևկող բնակարան՝ 85 ք.մ. մակերեսով, որը գտնվում է Տիգրան Մեծ պողոտայում` 5 հարկանի քարե` Ստալինյան նախագծի շենքի, 2-րդ հարկում: Բնակարանը վերանորոգված է։ Տեղադրված է եվրո պատուհաններ, երկաթե դուռ, հատակը ծածկված է լամինատով։ Առաստաղի բարձրությունը 3.15 մետր է: Սանհանգույցը սալիկապատված է և հագեցած է սանտեխնիկայով: Մոտակայքում են գտնվում բոլոր անհրաժեշտ խանութները, տրանսպորտի կանգառը։ Վաճառվում է խոհանոցի կահույքի հետ միասին: "
